{
  "chapter": 1,
  "generated_at": "2026-07-06T00:00:00Z",
  "purpose": "为第1章write提供可审计的 P0-P3 上下文",
  "source_files": [
    "state/chapters/chapter_1.json",
    "state/characters/char_001.json",
    "state/concepts/concept_001.json",
    "state/items/item_001.json",
    "state/metadata/project.json",
    "state/organizations/org_001.json",
    "state/plot_threads/plot_001.json",
    "state/relationships/rel_001.json",
    "state/scenes/scene_001.json",
    "state/timeline/event_001.json"
  ],
  "context_budget": {
    "target_words": 3000,
    "max_context_items": 16
  },
  "p0": [
    {
      "kind": "project",
      "id": null,
      "name": "玄天剑醒来",
      "summary": "仙侠、升级流、悬疑；文风：口语化,燃向；本章读者承诺：交付金手指觉醒和身份谜团",
      "source": "state/metadata/project.json",
      "priority": 10
    },
    {
      "kind": "concept",
      "id": "concept_001",
      "name": "灵根复测",
      "summary": "天剑宗每年对外门弟子重新检测资质与异常灵力波动的制度 所有外门弟子必须参加；异常者会被执事长老单独带走",
      "source": "state/concepts/concept_001.json",
      "priority": 10
    },
    {
      "kind": "organization",
      "id": "org_001",
      "name": "天剑宗",
      "summary": "以剑修传承闻名的正道宗门；资源：剑冢、外门祠堂、灵根测台；隐忧：古剑异动引来宗门旧案",
      "source": "state/organizations/org_001.json",
      "priority": 7
    }
  ],
  "p1": [
    {
      "kind": "character",
      "id": "char_001",
      "name": "林小雨",
      "summary": "林小雨 当前在 天剑宗外门祠堂，情绪 警惕，状态 健康，目标：隐藏玄天剑苏醒的秘密、通过灵根复测",
      "source": "state/characters/char_001.json",
      "priority": 10
    },
    {
      "kind": "item",
      "id": "item_001",
      "name": "玄天剑",
      "summary": "玄天剑 当前状态：苏醒；持有者：char_001；能力：能以残念传声；限制：能力来源未知、是否会被他人听见尚未确认",
      "source": "state/items/item_001.json",
      "priority": 9
    },
    {
      "kind": "scene",
      "id": "scene_001",
      "name": "天剑宗外门祠堂",
      "summary": "天剑宗外门祠堂：外门弟子供奉旧剑和领取杂役任务的地方；氛围：压抑而紧张；功能：主角秘密觉醒与宗门压力交汇的第一场景",
      "source": "state/scenes/scene_001.json",
      "priority": 8
    }
  ],
  "p2": [
    {
      "kind": "timeline_event",
      "id": "event_001",
      "name": "玄天剑苏醒",
      "summary": "第1章：林小雨听见玄天剑残念喊出自己的乳名，同时灵根复测即将开始。；后果：林小雨意识到玄天剑不是废铁、主线秘密和宗门压力同时启动",
      "source": "state/timeline/event_001.json",
      "priority": 8
    },
    {
      "kind": "relationship",
      "id": "rel_001",
      "name": "",
      "summary": "char_001 -> item_001：持有者与苏醒残剑；证据：第1章玄天剑叫出林小雨的乳名",
      "source": "state/relationships/rel_001.json",
      "priority": 6
    }
  ],
  "p3": [
    {
      "kind": "plot_thread",
      "id": "plot_001",
      "name": "玄天剑为何认识林小雨",
      "summary": "玄天剑为何认识林小雨（active，5%）：玄天剑残念知道林小雨隐藏身份，暗示主角身世与宗门旧案有关。",
      "source": "state/plot_threads/plot_001.json",
      "priority": 8
    },
    {
      "kind": "open_loop",
      "id": null,
      "name": "未解钩子",
      "summary": "玄天剑为何知道林小雨的乳名",
      "source": "state/chapters/chapter_1.json",
      "priority": 7
    },
    {
      "kind": "open_loop",
      "id": null,
      "name": "未解钩子",
      "summary": "灵根复测会不会发现玄天剑异动",
      "source": "state/chapters/chapter_1.json",
      "priority": 7
    }
  ],
  "must_include": {
    "characters": [
      "char_001"
    ],
    "items": [
      "item_001"
    ],
    "scenes": [
      "scene_001"
    ],
    "organizations": [
      "org_001"
    ],
    "concepts": [
      "concept_001"
    ],
    "timeline_events": [
      "event_001"
    ],
    "plot_threads": [
      "plot_001"
    ],
    "relationships": [
      "rel_001"
    ]
  },
  "writing_directives": [
    "完成章节目标：让林小雨发现玄天剑拥有意识，并启动灵根复测压力",
    "兑现读者承诺：交付金手指觉醒和身份谜团",
    "围绕冲突轴推进：林小雨想隐藏玄天剑异动，但宗门复测马上到来",
    "必须出现不可逆转折：玄天剑叫出林小雨从未告诉他人的乳名"
  ],
  "exclusions": [
    "不要改写 P0 锁定设定。",
    "不要引入 brief 未列入且用户未授权的重大新实体。"
  ],
  "open_questions": [
    "玄天剑为何知道林小雨的乳名",
    "灵根复测会不会发现玄天剑异动"
  ]
}
